{
  "$schema": "http://json-schema.org/draft-07/schema#",
  "title": "AICOS Studio Proposal Artifact",
  "type": "object",
  "additionalProperties": false,
  "required": [
    "artifact_type",
    "topic",
    "participants",
    "proposal_type",
    "claim_status",
    "evidence_status",
    "challenge_status",
    "drift_risk",
    "recommendation_scope",
    "promotion_state",
    "distilled_summary",
    "open_conflicts",
    "next_review_target"
  ],
  "properties": {
    "artifact_type": {
      "const": "proposal_artifact"
    },
    "packet_id": {
      "type": "string",
      "minLength": 1
    },
    "created_at": {
      "type": "string",
      "minLength": 1
    },
    "topic": {
      "type": "string",
      "minLength": 1
    },
    "participants": {
      "type": "array",
      "minItems": 1,
      "items": {
        "type": "string",
        "minLength": 1
      }
    },
    "proposal_type": {
      "type": "string",
      "enum": [
        "idea_probe",
        "card_review",
        "review_target_candidate",
        "registry_candidate_hint",
        "situation_analysis",
        "design_direction",
        "contradiction_packet",
        "challenge_dossier_seed"
      ]
    },
    "claim_status": {
      "type": "string",
      "enum": [
        "exploratory",
        "bounded_proposal",
        "conflicted",
        "insufficiently_formed"
      ]
    },
    "evidence_status": {
      "type": "string",
      "enum": [
        "conversation_only",
        "cross_reference_supported",
        "example_supported",
        "needs_evidence"
      ]
    },
    "challenge_status": {
      "type": "string",
      "enum": [
        "unchallenged",
        "challenge_in_progress",
        "challenged_with_open_conflicts",
        "challenge_passed_for_proposal_use"
      ]
    },
    "drift_risk": {
      "type": "string",
      "enum": [
        "low",
        "medium",
        "high"
      ]
    },
    "recommendation_scope": {
      "type": "string",
      "enum": [
        "archive_only",
        "proposal_only",
        "review_later",
        "request_human_decision"
      ]
    },
    "promotion_state": {
      "type": "string",
      "enum": [
        "proposal_only",
        "not_promoted"
      ]
    },
    "distilled_summary": {
      "type": "string",
      "minLength": 1
    },
    "open_conflicts": {
      "type": "array",
      "minItems": 1,
      "items": {
        "type": "string",
        "minLength": 1
      }
    },
    "next_review_target": {
      "type": "string",
      "enum": [
        "none",
        "human_registry_review",
        "manual_design_followup",
        "request_human_decision"
      ]
    },
    "source_refs": {
      "type": "array",
      "items": {
        "type": "string",
        "minLength": 1
      }
    },
    "distillator_notes": {
      "type": "string",
      "minLength": 1
    },
    "user_gate_decision": {
      "type": "string",
      "minLength": 1
    },
    "handoff_notes": {
      "type": "string",
      "minLength": 1
    }
  }
}
