{
  "artifact_type": "proposal_artifact",
  "packet_id": "studio-scenario-contradiction-review-001",
  "created_at": "2026-03-13T20:30:00Z",
  "topic": "whether provider convergence should ever bypass a later human gate in contradiction review",
  "participants": [
    "maya:moderator",
    "challenge_participant:red_team",
    "provider:gpt_reasoner",
    "human:operator"
  ],
  "proposal_type": "challenge_dossier_seed",
  "claim_status": "conflicted",
  "evidence_status": "needs_evidence",
  "challenge_status": "challenged_with_open_conflicts",
  "drift_risk": "high",
  "recommendation_scope": "request_human_decision",
  "promotion_state": "proposal_only",
  "distilled_summary": "the contradiction remains material: provider convergence may help later human prioritization, but it must not become a hidden substitute for a required human gate",
  "open_conflicts": [
    "there is no accepted threshold for treating convergence as more than advisory evidence"
  ],
  "next_review_target": "request_human_decision",
  "source_refs": [
    "AICOS_STUDIO_PIPELINE_SCENARIOS.md#scenario-3-contradiction-to-review-flow"
  ]
}
