{
  "artifact_type": "proposal_artifact",
  "handoff_notes": "Normalization only. Do not treat this as approval.",
  "source_refs": [
    "AICOS_STUDIO_ARTIFACT_TEMPLATES.md#template-2",
    "AICOS_STUDIO_ARTIFACT_TEMPLATES.md#template-1"
  ],
  "next_review_target": "manual_design_followup",
  "open_conflicts": [
    "future audit metadata depth is still debated"
  ],
  "distilled_summary": "future Studio implementation work should remain bounded by proposal-only artifacts and later human review gates rather than silent runtime or truth promotion",
  "promotion_state": "proposal_only",
  "recommendation_scope": "review_later",
  "drift_risk": "medium",
  "challenge_status": "challenged_with_open_conflicts",
  "evidence_status": "example_supported",
  "claim_status": "bounded_proposal",
  "proposal_type": "design_direction",
  "participants": [
    "human:operator",
    "maya:distillator",
    "provider:claude_sonnet",
    "human:operator"
  ],
  "topic": "keep studio outputs repo-near and proposal-only during future Maya implementation work",
  "created_at": "2026-03-13T19:05:00Z",
  "packet_id": "studio-proposal-normalize-001"
}
